{
  "$schema": "https://json-schema.org/draft/2020-12/schema",
  "$id": "https://agent-workbench.local/schemas/skill.schema.json",
  "title": "Agent Workbench Skill Contract",
  "type": "object",
  "required": ["id", "title", "useWhen"],
  "properties": {
    "id": { "type": "string", "pattern": "^[a-z0-9][a-z0-9._-]*$" },
    "title": { "type": "string", "minLength": 1 },
    "useWhen": { "type": "string", "minLength": 1 },
    "inputs": { "type": "array", "items": { "type": "string" } },
    "outputs": { "type": "array", "items": { "type": "string" } },
    "verify": { "type": "array", "items": { "type": "string" } }
  },
  "additionalProperties": true
}
